{
  "$schema": "https://json-schema.org/draft/2020-12/schema",
  "$id": "urn:openehr:cnf:schema:results:0.1.0",
  "title": "CNF 2.0 party results",
  "description": "The campaign outcomes for one technology profile: per-case×format outcome records (with mandatory citations on skipped/not_applicable), the ambiguity dispositions applied, and provenance (SUT/runner/ixit digest).",
  "type": "object",
  "additionalProperties": false,
  "required": [
    "sut",
    "runner",
    "schedule_release",
    "tech_profile",
    "ixit_digest"
  ],
  "properties": {
    "sut": {
      "type": "object",
      "additionalProperties": false,
      "required": [
        "name",
        "version"
      ],
      "properties": {
        "name": {
          "type": "string",
          "minLength": 1
        },
        "version": {
          "type": "string",
          "minLength": 1
        }
      }
    },
    "runner": {
      "type": "object",
      "additionalProperties": false,
      "required": [
        "name",
        "version",
        "verification_pack_status"
      ],
      "properties": {
        "name": {
          "type": "string",
          "minLength": 1
        },
        "version": {
          "type": "string",
          "minLength": 1
        },
        "verification_pack_status": {
          "enum": [
            "passed",
            "not_run",
            "failed"
          ]
        }
      }
    },
    "schedule_release": {
      "type": "string",
      "minLength": 1
    },
    "tech_profile": {
      "type": "object",
      "additionalProperties": false,
      "required": [
        "its"
      ],
      "properties": {
        "its": {
          "enum": [
            "its-rest"
          ]
        },
        "formats": {
          "type": "array",
          "items": {
            "enum": [
              "canonical-json",
              "canonical-xml",
              "wt-flat",
              "wt-structured",
              "wt"
            ]
          }
        }
      }
    },
    "ixit_digest": {
      "type": "string",
      "minLength": 1
    },
    "outcomes": {
      "type": "array",
      "items": {
        "type": "object",
        "additionalProperties": false,
        "required": [
          "case",
          "status",
          "rows_driven",
          "rows_total"
        ],
        "properties": {
          "case": {
            "type": "string",
            "pattern": "^\\S+$"
          },
          "format": {
            "enum": [
              "canonical-json",
              "canonical-xml",
              "wt-flat",
              "wt-structured",
              "wt"
            ]
          },
          "status": {
            "enum": [
              "passed",
              "failed",
              "errored",
              "skipped",
              "not_applicable"
            ]
          },
          "rows_driven": {
            "type": "integer",
            "minimum": 0
          },
          "rows_total": {
            "type": "integer",
            "minimum": 0
          },
          "failing_step": {
            "type": "integer",
            "minimum": 0
          },
          "reason": {
            "type": "string"
          },
          "citation": {
            "type": "string"
          },
          "failed_rows": {
            "type": "array",
            "items": {
              "type": "object",
              "additionalProperties": false,
              "required": [
                "row",
                "step",
                "reason"
              ],
              "properties": {
                "row": {
                  "type": "integer",
                  "minimum": 0
                },
                "step": {
                  "type": "integer",
                  "minimum": 0
                },
                "reason": {
                  "type": "string",
                  "minLength": 1
                }
              }
            }
          }
        },
        "allOf": [
          {
            "if": {
              "properties": {
                "status": {
                  "enum": [
                    "skipped",
                    "not_applicable"
                  ]
                }
              },
              "required": [
                "status"
              ]
            },
            "then": {
              "required": [
                "case",
                "status",
                "rows_driven",
                "rows_total",
                "citation"
              ],
              "properties": {
                "citation": {
                  "type": "string",
                  "minLength": 1
                }
              }
            }
          }
        ]
      }
    },
    "measurements": {
      "type": "array",
      "items": {
        "type": "object",
        "additionalProperties": false,
        "required": [
          "case",
          "class",
          "environment",
          "offered_load_sustained",
          "warmup_s",
          "duration_s",
          "operations",
          "verdict"
        ],
        "properties": {
          "case": {
            "type": "string",
            "pattern": "^\\S+$"
          },
          "class": {
            "enum": [
              "POC",
              "S",
              "L",
              "R"
            ]
          },
          "environment": {
            "type": "object",
            "additionalProperties": false,
            "required": [
              "hardware_class",
              "cores",
              "memory_gb",
              "storage_class",
              "topology"
            ],
            "properties": {
              "exclusive_server": {
                "type": "boolean"
              },
              "hardware_class": {
                "type": "string",
                "minLength": 1
              },
              "cores": {
                "type": "integer",
                "minimum": 0
              },
              "memory_gb": {
                "type": "integer",
                "minimum": 0
              },
              "storage_class": {
                "type": "string",
                "minLength": 1
              },
              "topology": {
                "type": "string",
                "minLength": 1
              }
            }
          },
          "offered_load_sustained": {
            "type": "number",
            "minimum": 0.0
          },
          "warmup_s": {
            "type": "integer",
            "minimum": 0
          },
          "duration_s": {
            "type": "integer",
            "minimum": 1
          },
          "operations": {
            "type": "array",
            "minItems": 1,
            "items": {
              "type": "object",
              "additionalProperties": false,
              "required": [
                "operation",
                "requests",
                "errors",
                "latency_ms_p50",
                "latency_ms_p90",
                "latency_ms_p99",
                "hdr_v2_base64"
              ],
              "properties": {
                "operation": {
                  "type": "string",
                  "minLength": 1
                },
                "requests": {
                  "type": "integer",
                  "minimum": 0
                },
                "errors": {
                  "type": "integer",
                  "minimum": 0
                },
                "latency_ms_p50": {
                  "type": "number",
                  "minimum": 0.0
                },
                "latency_ms_p90": {
                  "type": "number",
                  "minimum": 0.0
                },
                "latency_ms_p99": {
                  "type": "number",
                  "minimum": 0.0
                },
                "hdr_v2_base64": {
                  "type": "string",
                  "minLength": 1
                }
              }
            }
          },
          "verdict": {
            "enum": [
              "earned",
              "not-earned"
            ]
          },
          "violations": {
            "type": "array",
            "items": {
              "type": "string",
              "minLength": 1
            }
          },
          "resources": {
            "type": "object",
            "additionalProperties": false,
            "required": [
              "sample_interval_s",
              "containers"
            ],
            "properties": {
              "sample_interval_s": {
                "type": "integer",
                "minimum": 1
              },
              "containers": {
                "type": "array",
                "items": {
                  "type": "object",
                  "additionalProperties": false,
                  "required": [
                    "role",
                    "name",
                    "samples"
                  ],
                  "properties": {
                    "role": {
                      "enum": [
                        "sut",
                        "db"
                      ]
                    },
                    "name": {
                      "type": "string",
                      "minLength": 1
                    },
                    "samples": {
                      "type": "array",
                      "items": {
                        "type": "object",
                        "additionalProperties": false,
                        "required": [
                          "offset_s",
                          "phase",
                          "cpu_pct",
                          "rss_bytes",
                          "blk_read_bytes",
                          "blk_write_bytes",
                          "net_rx_bytes",
                          "net_tx_bytes"
                        ],
                        "properties": {
                          "offset_s": {
                            "type": "integer",
                            "minimum": 0
                          },
                          "phase": {
                            "enum": [
                              "warmup",
                              "measured",
                              "drain"
                            ]
                          },
                          "cpu_pct": {
                            "type": "number",
                            "minimum": 0.0
                          },
                          "rss_bytes": {
                            "type": "integer",
                            "minimum": 0
                          },
                          "blk_read_bytes": {
                            "type": "integer",
                            "minimum": 0
                          },
                          "blk_write_bytes": {
                            "type": "integer",
                            "minimum": 0
                          },
                          "net_rx_bytes": {
                            "type": "integer",
                            "minimum": 0
                          },
                          "net_tx_bytes": {
                            "type": "integer",
                            "minimum": 0
                          }
                        }
                      }
                    }
                  }
                }
              },
              "disk": {
                "type": "object",
                "additionalProperties": false,
                "properties": {
                  "before_scale_seed_bytes": {
                    "type": "integer",
                    "minimum": 0
                  },
                  "after_scale_seed_bytes": {
                    "type": "integer",
                    "minimum": 0
                  },
                  "after_ward_seed_bytes": {
                    "type": "integer",
                    "minimum": 0
                  },
                  "after_window_bytes": {
                    "type": "integer",
                    "minimum": 0
                  },
                  "seed_compositions": {
                    "type": "integer",
                    "minimum": 1
                  }
                }
              }
            }
          }
        }
      }
    },
    "ambiguity_dispositions": {
      "type": "array",
      "items": {
        "type": "object",
        "additionalProperties": false,
        "required": [
          "ambiguity"
        ],
        "properties": {
          "ambiguity": {
            "type": "string",
            "pattern": "^AMB-[0-9]+$"
          },
          "option": {
            "type": "string",
            "pattern": "^[a-z0-9_-]+$"
          }
        }
      }
    }
  }
}
