{
  "sut": {
    "name": "ehrbase-java",
    "version": "2.34.0"
  },
  "runner": {
    "name": "cnf-runner",
    "version": "3.7.0",
    "verification_pack_status": "passed"
  },
  "schedule_release": "cnf-2.0-w2",
  "tech_profile": {
    "its": "its-rest",
    "formats": [
      "canonical-json"
    ]
  },
  "ixit_digest": "bd88c8dadd68a7ce",
  "outcomes": [
    {
      "case": "I_DEFINITION_ADL14.get_opts-retrieve_all_no_opts",
      "status": "passed",
      "rows_driven": 1,
      "rows_total": 1
    },
    {
      "case": "I_DEFINITION_ADL2.has_artefact-non_existing",
      "status": "errored",
      "rows_driven": 1,
      "rows_total": 1,
      "failing_step": 1,
      "reason": "status 501 maps to no outcome of the operation's binding (inconclusive)"
    },
    {
      "case": "I_DEFINITION_ADL2.list_opts-empty",
      "status": "errored",
      "rows_driven": 1,
      "rows_total": 1,
      "failing_step": 1,
      "reason": "status 501 maps to no outcome of the operation's binding (inconclusive)"
    },
    {
      "case": "I_DEFINITION_QUERY.list_queries-empty",
      "status": "passed",
      "rows_driven": 1,
      "rows_total": 1
    },
    {
      "case": "I_ADMIN_ARCHIVE.archive_ehrs-archive_selected",
      "status": "not_applicable",
      "rows_driven": 0,
      "rows_total": 1,
      "citation": "I_ADMIN_ARCHIVE.archive_ehrs: AMB-33"
    },
    {
      "case": "I_ADMIN_ARCHIVE.archive_ehrs-archive_unknown",
      "status": "not_applicable",
      "rows_driven": 0,
      "rows_total": 1,
      "citation": "I_ADMIN_ARCHIVE.archive_ehrs: AMB-33"
    },
    {
      "case": "I_ADMIN_ARCHIVE.archive_parties-archive_selected",
      "status": "not_applicable",
      "rows_driven": 0,
      "rows_total": 1,
      "citation": "I_ADMIN_ARCHIVE.archive_parties: AMB-33"
    },
    {
      "case": "I_ADMIN_ARCHIVE.archive_parties-archive_unknown",
      "status": "not_applicable",
      "rows_driven": 0,
      "rows_total": 1,
      "citation": "I_ADMIN_ARCHIVE.archive_parties: AMB-33"
    },
    {
      "case": "I_ADMIN_DUMP_LOAD.export_ehrs-export_all",
      "status": "not_applicable",
      "rows_driven": 0,
      "rows_total": 1,
      "citation": "I_ADMIN_DUMP_LOAD.export_ehrs: AMB-33"
    },
    {
      "case": "I_ADMIN_DUMP_LOAD.export_ehrs-export_formats",
      "status": "not_applicable",
      "rows_driven": 0,
      "rows_total": 1,
      "citation": "I_ADMIN_DUMP_LOAD.export_ehrs: AMB-33"
    },
    {
      "case": "I_ADMIN_SERVICE.composition_version_count-all",
      "status": "not_applicable",
      "rows_driven": 0,
      "rows_total": 1,
      "citation": "I_ADMIN_SERVICE.composition_version_count: AMB-33"
    },
    {
      "case": "I_ADMIN_SERVICE.composition_version_count-time_range",
      "status": "not_applicable",
      "rows_driven": 0,
      "rows_total": 1,
      "citation": "I_ADMIN_SERVICE.composition_version_count: AMB-33"
    },
    {
      "case": "I_ADMIN_SERVICE.contribution_count-all",
      "status": "not_applicable",
      "rows_driven": 0,
      "rows_total": 1,
      "citation": "I_ADMIN_SERVICE.contribution_count: AMB-33"
    },
    {
      "case": "I_ADMIN_SERVICE.contribution_count-time_range",
      "status": "not_applicable",
      "rows_driven": 0,
      "rows_total": 1,
      "citation": "I_ADMIN_SERVICE.contribution_count: AMB-33"
    },
    {
      "case": "I_ADMIN_SERVICE.list_contributions-all",
      "status": "not_applicable",
      "rows_driven": 0,
      "rows_total": 1,
      "citation": "I_ADMIN_SERVICE.list_contributions: AMB-33"
    },
    {
      "case": "I_ADMIN_SERVICE.list_contributions-time_range",
      "status": "not_applicable",
      "rows_driven": 0,
      "rows_total": 1,
      "citation": "I_ADMIN_SERVICE.list_contributions: AMB-33"
    },
    {
      "case": "I_ADMIN_SERVICE.physical_ehr_delete-delete_existing",
      "status": "failed",
      "rows_driven": 1,
      "rows_total": 1,
      "failing_step": 1,
      "reason": "expected `ok_empty`, observed `not_found`",
      "failed_rows": [
        {
          "row": 0,
          "step": 1,
          "reason": "expected `ok_empty`, observed `not_found`"
        }
      ]
    },
    {
      "case": "I_ADMIN_SERVICE.physical_ehr_delete-delete_non_existing",
      "status": "passed",
      "rows_driven": 1,
      "rows_total": 1
    },
    {
      "case": "I_ADMIN_SERVICE.physical_party_delete-delete_existing",
      "status": "not_applicable",
      "rows_driven": 0,
      "rows_total": 1,
      "citation": "I_ADMIN_SERVICE.physical_party_delete: AMB-33"
    },
    {
      "case": "I_ADMIN_SERVICE.physical_party_delete-delete_non_existing",
      "status": "not_applicable",
      "rows_driven": 0,
      "rows_total": 1,
      "citation": "I_ADMIN_SERVICE.physical_party_delete: AMB-33"
    },
    {
      "case": "I_ADMIN_SERVICE.versioned_composition_count-all",
      "status": "not_applicable",
      "rows_driven": 0,
      "rows_total": 1,
      "citation": "I_ADMIN_SERVICE.versioned_composition_count: AMB-33"
    },
    {
      "case": "I_ADMIN_SERVICE.versioned_composition_count-time_range",
      "status": "not_applicable",
      "rows_driven": 0,
      "rows_total": 1,
      "citation": "I_ADMIN_SERVICE.versioned_composition_count: AMB-33"
    },
    {
      "case": "I_EHR_COMPOSITION.create_composition-event",
      "status": "passed",
      "rows_driven": 1,
      "rows_total": 1
    },
    {
      "case": "I_EHR_COMPOSITION.create_composition-event_bad_ehr",
      "status": "passed",
      "rows_driven": 1,
      "rows_total": 1
    },
    {
      "case": "I_EHR_COMPOSITION.create_composition-event_bad_opt",
      "status": "passed",
      "rows_driven": 1,
      "rows_total": 1
    },
    {
      "case": "I_EHR_COMPOSITION.create_composition-invalid_event",
      "status": "passed",
      "rows_driven": 1,
      "rows_total": 1
    },
    {
      "case": "I_EHR_COMPOSITION.create_composition-invalid_persistent",
      "status": "passed",
      "rows_driven": 1,
      "rows_total": 1
    },
    {
      "case": "I_EHR_COMPOSITION.create_composition-persistent",
      "status": "errored",
      "rows_driven": 1,
      "rows_total": 1,
      "failing_step": 1,
      "reason": "status 400 maps to no outcome of the operation's binding (inconclusive)"
    },
    {
      "case": "I_EHR_COMPOSITION.create_composition-same_opt_twice",
      "status": "errored",
      "rows_driven": 1,
      "rows_total": 1,
      "failing_step": 1,
      "reason": "status 400 maps to no outcome of the operation's binding (inconclusive)"
    },
    {
      "case": "I_EHR_COMPOSITION.delete_composition-event",
      "status": "passed",
      "rows_driven": 1,
      "rows_total": 1
    },
    {
      "case": "I_EHR_COMPOSITION.delete_composition-non_existent",
      "status": "passed",
      "rows_driven": 1,
      "rows_total": 1
    },
    {
      "case": "I_EHR_COMPOSITION.delete_composition-persistent",
      "status": "errored",
      "rows_driven": 1,
      "rows_total": 1,
      "failing_step": 1,
      "reason": "status 400 maps to no outcome of the operation's binding (inconclusive)"
    },
    {
      "case": "I_EHR_COMPOSITION.get_composition_at_time-bad_composition",
      "status": "passed",
      "rows_driven": 1,
      "rows_total": 1
    },
    {
      "case": "I_EHR_COMPOSITION.get_composition_at_time-bad_ehr",
      "status": "passed",
      "rows_driven": 1,
      "rows_total": 1
    },
    {
      "case": "I_EHR_COMPOSITION.get_composition_at_time-no_time_arg",
      "status": "failed",
      "rows_driven": 1,
      "rows_total": 1,
      "failing_step": 2,
      "reason": "expected `updated`, observed `precondition_missing`",
      "failed_rows": [
        {
          "row": 0,
          "step": 2,
          "reason": "expected `updated`, observed `precondition_missing`"
        }
      ]
    },
    {
      "case": "I_EHR_COMPOSITION.get_composition_at_time",
      "status": "failed",
      "rows_driven": 1,
      "rows_total": 1,
      "failing_step": 2,
      "reason": "equivalent: retrieved content differs from committed (modulo the normative ignore-set); got {\"_type\":\"COMPOSITION\",\"name\":{\"_type\":\"DV_TEXT\",\"value\":\"Minimal\"},\"archetype_d … want {\"_type\":\"COMPOSITION\",\"name\":{\"_type\":\"DV_TEXT\",\"value\":\"Minimal\"},\"archetype_d …",
      "failed_rows": [
        {
          "row": 0,
          "step": 2,
          "reason": "equivalent: retrieved content differs from committed (modulo the normative ignore-set); got {\"_type\":\"COMPOSITION\",\"name\":{\"_type\":\"DV_TEXT\",\"value\":\"Minimal\"},\"archetype_d … want {\"_type\":\"COMPOSITION\",\"name\":{\"_type\":\"DV_TEXT\",\"value\":\"Minimal\"},\"archetype_d …"
        }
      ]
    },
    {
      "case": "I_EHR_COMPOSITION.get_composition_at_times",
      "status": "failed",
      "rows_driven": 1,
      "rows_total": 1,
      "failing_step": 2,
      "reason": "expected `updated`, observed `precondition_missing`",
      "failed_rows": [
        {
          "row": 0,
          "step": 2,
          "reason": "expected `updated`, observed `precondition_missing`"
        }
      ]
    },
    {
      "case": "I_EHR_COMPOSITION.get_composition_latest-bad_composition",
      "status": "passed",
      "rows_driven": 1,
      "rows_total": 1
    },
    {
      "case": "I_EHR_COMPOSITION.get_composition_latest-bad_ehr",
      "status": "passed",
      "rows_driven": 1,
      "rows_total": 1
    },
    {
      "case": "I_EHR_COMPOSITION.get_composition_latest",
      "status": "failed",
      "rows_driven": 1,
      "rows_total": 1,
      "failing_step": 2,
      "reason": "expected `updated`, observed `precondition_missing`",
      "failed_rows": [
        {
          "row": 0,
          "step": 2,
          "reason": "expected `updated`, observed `precondition_missing`"
        }
      ]
    },
    {
      "case": "I_EHR_COMPOSITION.get_composition_version-bad_ehr",
      "status": "passed",